{
  "artifacts": [],
  "blocked_reason": "The implementation requires a product decision before changing behavior.",
  "completed_at": "2026-04-29T18:08:00Z",
  "completed_work_units": [],
  "error": {
    "message": "Blocked on product decision."
  },
  "failed_work_units": [],
  "handoff_path": "runs/01ARZ3NDEKTSV4RRFFQ69G5FAV/phase_handoffs/1/attempt-1.handoff.json",
  "launcher": "claude-print",
  "needs_input": [],
  "phase_attempt": 1,
  "phase_content_sha": "bbbbbbbbbbbbbbbbbbbbbbbbbbbbbbbbbbbbbbbbbbbbbbbbbbbbbbbbbbbbbbbb",
  "phase_id": "1",
  "prepared_plan_sha": "aaaaaaaaaaaaaaaaaaaaaaaaaaaaaaaaaaaaaaaaaaaaaaaaaaaaaaaaaaaaaaaa",
  "run_id": "01ARZ3NDEKTSV4RRFFQ69G5FAV",
  "schema_version": 1,
  "session_name": "swarmdaddy-01ARZ3NDEKTSV4RRFFQ69G5FAV-1-attempt-1",
  "started_at": "2026-04-29T18:00:00Z",
  "status": "blocked",
  "summary": "The phase is blocked until the owner chooses the desired behavior.",
  "validation": []
}
